{
  "$schema": "https://json-schema.org/draft/2020-12/schema",
  "$id": "https://raw.githubusercontent.com/Sharper-Flow/concord/main/contracts/adapter-host-pin.schema.json",
  "title": "Concord adapter host pin",
  "description": "Closed contract for the host declarations the adapter typechecks against. The manifest pins the real published declarations at an exact version, so the typecheck reads what the host actually declares; a hand-written mirror of the host surface would keep compiling after upstream removed or changed a declaration. Allowances work the way the cognitive-complexity budget's do - each records the error count observed when it was granted, and the check fails when the real count no longer matches, in either direction. An allowance is permission for a known divergence to exist at a recorded size, not permission to diverge.",
  "type": "object",
  "additionalProperties": false,
  "required": [
    "schema_version",
    "sources",
    "packages",
    "typescript",
    "compiler_options",
    "allowances",
    "runtime_probe"
  ],
  "properties": {
    "schema_version": {
      "type": "string",
      "enum": [
        "1.0"
      ]
    },
    "sources": {
      "description": "Directories whose TypeScript is typechecked against the pinned packages. The whole adapter is checked, tests included, because a test that constructs a host type is asserting the same contract the runtime does.",
      "type": "array",
      "minItems": 1,
      "maxItems": 8,
      "items": {
        "type": "string",
        "minLength": 1,
        "maxLength": 128
      }
    },
    "packages": {
      "description": "The published packages installed into the staged workspace, at exact versions. An exact version is what makes the typecheck reproducible: a host upgrade surfaces as a reviewable manifest diff rather than a CI failure nobody can date. A range cannot do this.",
      "type": "array",
      "minItems": 1,
      "maxItems": 16,
      "items": {
        "type": "object",
        "additionalProperties": false,
        "required": [
          "name",
          "version",
          "declares"
        ],
        "properties": {
          "name": {
            "type": "string",
            "minLength": 1,
            "maxLength": 128
          },
          "version": {
            "description": "Exact version. Ranges are rejected: the point of the pin is that one specific set of declarations was reviewed.",
            "type": "string",
            "pattern": "^[0-9]+\\.[0-9]+\\.[0-9]+$"
          },
          "declares": {
            "description": "What this package supplies to the typecheck, in terms a reviewer can check against the adapter's imports.",
            "type": "string",
            "minLength": 12,
            "maxLength": 512
          }
        }
      }
    },
    "typescript": {
      "description": "Exact compiler version. Pinned for the same reason the packages are: a compiler upgrade changes what the check can see.",
      "type": "string",
      "pattern": "^[0-9]+\\.[0-9]+\\.[0-9]+$"
    },
    "compiler_options": {
      "description": "The compiler options the staged typecheck runs under. They live here rather than in a checked-in tsconfig because the typecheck only ever runs in the staged workspace, and two copies of a configuration are one more than can stay in agreement.",
      "type": "object",
      "additionalProperties": false,
      "required": [
        "target",
        "module",
        "moduleResolution",
        "lib",
        "types",
        "strict",
        "noUnusedLocals",
        "noUnusedParameters",
        "noEmit",
        "skipLibCheck",
        "resolveJsonModule",
        "forceConsistentCasingInFileNames",
        "allowJs"
      ],
      "properties": {
        "target": {
          "type": "string",
          "minLength": 1,
          "maxLength": 32
        },
        "module": {
          "type": "string",
          "minLength": 1,
          "maxLength": 32
        },
        "moduleResolution": {
          "type": "string",
          "minLength": 1,
          "maxLength": 32
        },
        "lib": {
          "type": "array",
          "minItems": 1,
          "maxItems": 8,
          "items": {
            "type": "string",
            "minLength": 1,
            "maxLength": 32
          }
        },
        "types": {
          "description": "Ambient type packages. Every entry must name a pinned package, so the check cannot silently depend on a global type surface nobody pinned.",
          "type": "array",
          "minItems": 0,
          "maxItems": 8,
          "items": {
            "type": "string",
            "minLength": 1,
            "maxLength": 128
          }
        },
        "strict": {
          "description": "Never false. A non-strict typecheck does not prove the adapter compiles against the declared host surface.",
          "type": "boolean",
          "const": true
        },
        "noUnusedLocals": {
          "description": "Never false. An unread local or import is dead code the typecheck reports.",
          "type": "boolean",
          "const": true
        },
        "noUnusedParameters": {
          "description": "Never false. A parameter no body reads is dead surface; a callback that must keep its position names it with a leading underscore.",
          "type": "boolean",
          "const": true
        },
        "noEmit": {
          "type": "boolean",
          "const": true
        },
        "skipLibCheck": {
          "type": "boolean"
        },
        "resolveJsonModule": {
          "type": "boolean"
        },
        "forceConsistentCasingInFileNames": {
          "type": "boolean"
        },
        "allowJs": {
          "description": "Admits shipped JavaScript source modules and infers their JSDoc types for TypeScript consumers. JavaScript behavior remains covered by the adapter tests.",
          "type": "boolean"
        }
      }
    },
    "allowances": {
      "description": "Known divergences between the adapter and the pinned declarations. Each is a diagnostic the typecheck is expected to emit; anything else fails the check.",
      "type": "array",
      "minItems": 0,
      "maxItems": 64,
      "items": {
        "type": "object",
        "additionalProperties": false,
        "required": [
          "file",
          "code",
          "count",
          "state",
          "reason"
        ],
        "properties": {
          "file": {
            "description": "Source file name within a checked directory. Line and column are deliberately excluded: the identity being declared is the divergence, not where it currently sits.",
            "type": "string",
            "pattern": "^[A-Za-z0-9_.-]+\\.ts$",
            "minLength": 4,
            "maxLength": 128
          },
          "code": {
            "description": "TypeScript diagnostic code, as emitted.",
            "type": "string",
            "pattern": "^TS[0-9]{4,5}$"
          },
          "count": {
            "description": "Diagnostics with this file and code observed when the allowance was granted or last revised. The check requires an exact match, so a divergence that spreads fails as a regression and one that shrinks fails as a stale allowance.",
            "type": "integer",
            "minimum": 1,
            "maximum": 100
          },
          "state": {
            "description": "outstanding: the divergence should be resolved and an issue tracks it. out_of_scope: an accepted decision keeps it, and it is declared rather than excused. unmeasured: nobody has established whether the adapter or the declaration is wrong.",
            "type": "string",
            "enum": [
              "outstanding",
              "unmeasured",
              "out_of_scope"
            ]
          },
          "issue": {
            "description": "Public issue tracking an outstanding allowance. Required when outstanding; forbidden otherwise.",
            "type": "integer",
            "minimum": 1
          },
          "reason": {
            "description": "What diverges and why it is allowed, in terms a reviewer can check against the code and the pinned declaration. A reason that only restates the diagnostic is not a reason.",
            "type": "string",
            "minLength": 12,
            "maxLength": 1024
          }
        }
      }
    },
    "runtime_probe": {
      "description": "Closed evidence from a probe against the pinned OpenCode runtime. The probe checks the host result boundary and records the host truncation defaults that constrain Concord's envelope.",
      "type": "object",
      "additionalProperties": false,
      "required": [
        "probe_identity",
        "runner",
        "observed_on",
        "host_package",
        "host_version",
        "source_urls",
        "commands",
        "bare_object_failure",
        "conforming_result_success",
        "limits"
      ],
      "properties": {
        "probe_identity": {
          "const": "tool-result-contract-v1"
        },
        "runner": {
          "const": "python3 scripts/probe-adapter-host-result.py"
        },
        "observed_on": {
          "type": "string",
          "format": "date"
        },
        "host_package": {
          "const": "opencode-ai"
        },
        "host_version": {
          "type": "string",
          "pattern": "^[0-9]+\\.[0-9]+\\.[0-9]+$"
        },
        "source_urls": {
          "type": "array",
          "minItems": 1,
          "maxItems": 8,
          "items": {
            "type": "string",
            "minLength": 12,
            "maxLength": 512
          }
        },
        "commands": {
          "type": "object",
          "additionalProperties": false,
          "required": [
            "bare",
            "conforming"
          ],
          "properties": {
            "bare": {
              "type": "string",
              "minLength": 1,
              "maxLength": 512
            },
            "conforming": {
              "type": "string",
              "minLength": 1,
              "maxLength": 512
            }
          }
        },
        "bare_object_failure": {
          "type": "object",
          "additionalProperties": false,
          "required": [
            "status",
            "exit_code",
            "error_contains"
          ],
          "properties": {
            "status": {
              "const": "failed"
            },
            "exit_code": {
              "type": "integer",
              "minimum": 1
            },
            "error_contains": {
              "const": "undefined is not an object (evaluating 'c.split')"
            }
          }
        },
        "conforming_result_success": {
          "type": "object",
          "additionalProperties": false,
          "required": [
            "status",
            "exit_code",
            "output",
            "metadata_truncated"
          ],
          "properties": {
            "status": {
              "const": "passed"
            },
            "exit_code": {
              "const": 0
            },
            "output": {
              "const": "{}"
            },
            "metadata_truncated": {
              "const": false
            }
          }
        },
        "limits": {
          "type": "object",
          "additionalProperties": false,
          "required": [
            "max_bytes",
            "max_lines"
          ],
          "properties": {
            "max_bytes": {
              "const": 51200
            },
            "max_lines": {
              "const": 2000
            }
          }
        }
      }
    }
  }
}
