{
  "schema_version": "1.0",
  "sources": [
    "adapter/opencode"
  ],
  "packages": [
    {
      "name": "@opencode-ai/plugin",
      "version": "1.18.23",
      "declares": "ToolContext, tool(), tool.schema, and ToolResult - the host surface concord.ts, packet.ts, and lane_dispatch.ts import."
    },
    {
      "name": "bun-types",
      "version": "1.4.0",
      "declares": "bun:test, the Bun global, Buffer, process, crypto, AbortController, and Array.fromAsync. Matches the Bun version .github/workflows/ci.yml installs."
    }
  ],
  "typescript": "5.9.3",
  "compiler_options": {
    "target": "es2022",
    "module": "esnext",
    "moduleResolution": "bundler",
    "lib": [
      "es2022"
    ],
    "types": [
      "bun-types"
    ],
    "strict": true,
    "noUnusedLocals": true,
    "noUnusedParameters": true,
    "noEmit": true,
    "skipLibCheck": true,
    "resolveJsonModule": true,
    "forceConsistentCasingInFileNames": true,
    "allowJs": true
  },
  "allowances": [
  ],
  "runtime_probe": {
    "probe_identity": "tool-result-contract-v1",
    "runner": "python3 scripts/probe-adapter-host-result.py",
    "observed_on": "2026-08-29",
    "host_package": "opencode-ai",
    "host_version": "1.18.23",
    "source_urls": [
      "https://github.com/anomalyco/opencode/blob/v1.18.23/packages/opencode/src/tool/registry.ts",
      "https://github.com/anomalyco/opencode/blob/v1.18.23/packages/opencode/src/tool/truncate.ts"
    ],
    "commands": {
      "bare": "bunx opencode-ai@1.18.23 --pure debug agent build --tool result-probe_bare --params '{}'",
      "conforming": "bunx opencode-ai@1.18.23 --pure debug agent build --tool result-probe_conforming --params '{}'"
    },
    "bare_object_failure": {
      "status": "failed",
      "exit_code": 1,
      "error_contains": "undefined is not an object (evaluating 'c.split')"
    },
    "conforming_result_success": {
      "status": "passed",
      "exit_code": 0,
      "output": "{}",
      "metadata_truncated": false
    },
    "limits": {
      "max_bytes": 51200,
      "max_lines": 2000
    }
  }
}
